{
  "analysis_digest": "sha256:a21cef9eccac92aa65e5f8d38a18a82dc0eafb2484d2c716b2eeaee6e5f22437",
  "completeness": {
    "reasons": [
      "Incomplete.Static_analysis",
      "Incomplete.Unbound_build_source_commit",
      "Incomplete.Unresolved_dependency: node:14.16.1"
    ],
    "state": "incomplete"
  },
  "diagnostics": [],
  "digest": "sha256:f5fc2e99515fd10b79403cbfe923d688948974cdc9550d99e5379b6a35802f2f",
  "gate": {
    "exit_code": 0,
    "result": "pass"
  },
  "inputs": {
    "config": {
      "digest": "sha256:e3b0c44298fc1c149afbf4c8996fb92427ae41e4649b934ca495991b7852b855",
      "origin": "built-in",
      "trust": "built-in"
    },
    "lock": {
      "digest": "sha256:e3b0c44298fc1c149afbf4c8996fb92427ae41e4649b934ca495991b7852b855"
    },
    "manifest_digest": "sha256:00155338858381774bd5db0ba7ab1ef7fb6625c4dcbb41f78d37c76cacd8d1dd",
    "sources": [
      {
        "digest": "sha256:cd0d0e7f29f8a19667861f25f119649467fa2e78e88b9a1469c813b04e7d04e8",
        "id": 0,
        "path": ".gitlab-ci.yml"
      }
    ]
  },
  "persona": "audit",
  "properties": [
    {
      "explanation": "AI agent input is trusted or isolated from tools and network",
      "id": "WV-AI-001",
      "state": "NotApplicable"
    },
    {
      "explanation": "artifact integrity is preserved across producers and consumers",
      "id": "WV-ARTIFACT-001",
      "state": "NotApplicable"
    },
    {
      "explanation": "every privileged effect is dominated by an authorization gate",
      "id": "WV-AUTH-001",
      "state": "NotApplicable"
    },
    {
      "explanation": "cache integrity is preserved across producers and consumers",
      "id": "WV-CACHE-001",
      "state": "NotApplicable"
    },
    {
      "explanation": "the lowered graph is well-formed, phase-valid, and acyclic",
      "id": "WV-CORRECT-001",
      "state": "Proved"
    },
    {
      "explanation": "credentials do not persist into reusable runner state",
      "id": "WV-CRED-001",
      "state": "NotApplicable"
    },
    {
      "explanation": "granted capabilities are required by a reachable effect",
      "id": "WV-PERM-001",
      "state": "NotApplicable"
    },
    {
      "explanation": "untrusted values do not cross an unquoted command boundary",
      "id": "WV-SEC-001",
      "state": "Proved"
    },
    {
      "explanation": "secret values do not reach network, output, or logging effects",
      "id": "WV-SEC-002",
      "state": "Proved"
    },
    {
      "explanation": "workflow execution cannot rewrite trusted CI definitions",
      "id": "WV-SELF-001",
      "state": "NotApplicable"
    },
    {
      "explanation": "remote executable dependencies are content-addressed",
      "id": "WV-SUPPLY-001",
      "reasons": [
        {
          "detail": "node:14.16.1",
          "kind": "unresolved_dependency"
        }
      ],
      "state": "Unknown"
    },
    {
      "explanation": "untrusted checkout selection cannot race a privileged consumer",
      "id": "WV-TOCTOU-001",
      "state": "NotApplicable"
    }
  ],
  "providers": [
    "gitlab-semantic-v1"
  ],
  "schema": "workflow-verifier-report/1",
  "summary": {
    "diagnostics": 0,
    "edges": 22,
    "nodes": 18,
    "properties": 12,
    "sources": 1,
    "unknown_properties": 1,
    "violated_properties": 0
  },
  "tool": {
    "commit": null,
    "compiler": "rustc 1.98.0 (88d9e12ae 2026-08-18)",
    "name": "workflow-verifier",
    "target": "x86_64-unknown-linux-gnu",
    "version": "0.1.0"
  }
}
