{
  "analysis_digest": "sha256:30208320abe020de2e25f7ad4ee951440b5ed3d58d51be000e00af2ead901168",
  "completeness": {
    "reasons": [
      "Incomplete.Unbound_build_source_commit",
      "Incomplete.Unresolved_dependency: templates/build-benchmark.yml",
      "Incomplete.Unresolved_dependency: templates/build-ctl.yml",
      "Incomplete.Unresolved_dependency: templates/build-internal.yml",
      "Incomplete.Unresolved_dependency: templates/build-preview.yml",
      "Incomplete.Unresolved_dependency: templates/build-samples.yml",
      "Incomplete.Unresolved_dependency: templates/build-test.yml",
      "Incomplete.Unresolved_dependency: templates/nuget-pack.yml",
      "Incomplete.Unresolved_dependency: templates/static-tools.yml"
    ],
    "state": "incomplete"
  },
  "diagnostics": [],
  "digest": "sha256:cd64ec6cc4e126850f48cdd523983ebef312fe78991ede423b5b6f0b77ce1aad",
  "gate": {
    "exit_code": 0,
    "result": "pass"
  },
  "inputs": {
    "config": {
      "digest": "sha256:e3b0c44298fc1c149afbf4c8996fb92427ae41e4649b934ca495991b7852b855",
      "origin": "built-in",
      "trust": "built-in"
    },
    "lock": {
      "digest": "sha256:e3b0c44298fc1c149afbf4c8996fb92427ae41e4649b934ca495991b7852b855"
    },
    "manifest_digest": "sha256:f33c0e6b4f956641fd505c3c34de1cb8a3544890fc5004f12926593d16beaed8",
    "sources": [
      {
        "digest": "sha256:b75399c516e091d3a195a222c65ca86209bbcaa8f5014c0b8f5318f9755e769b",
        "id": 0,
        "path": "azure-pipelines.yml"
      }
    ]
  },
  "persona": "audit",
  "properties": [
    {
      "explanation": "AI agent input is trusted or isolated from tools and network",
      "id": "WV-AI-001",
      "state": "NotApplicable"
    },
    {
      "explanation": "artifact integrity is preserved across producers and consumers",
      "id": "WV-ARTIFACT-001",
      "state": "NotApplicable"
    },
    {
      "explanation": "every privileged effect is dominated by an authorization gate",
      "id": "WV-AUTH-001",
      "state": "NotApplicable"
    },
    {
      "explanation": "cache integrity is preserved across producers and consumers",
      "id": "WV-CACHE-001",
      "state": "NotApplicable"
    },
    {
      "explanation": "the lowered graph is well-formed, phase-valid, and acyclic",
      "id": "WV-CORRECT-001",
      "state": "Proved"
    },
    {
      "explanation": "credentials do not persist into reusable runner state",
      "id": "WV-CRED-001",
      "state": "NotApplicable"
    },
    {
      "explanation": "granted capabilities are required by a reachable effect",
      "id": "WV-PERM-001",
      "state": "NotApplicable"
    },
    {
      "explanation": "untrusted values do not cross an unquoted command boundary",
      "id": "WV-SEC-001",
      "state": "NotApplicable"
    },
    {
      "explanation": "secret values do not reach network, output, or logging effects",
      "id": "WV-SEC-002",
      "state": "NotApplicable"
    },
    {
      "explanation": "workflow execution cannot rewrite trusted CI definitions",
      "id": "WV-SELF-001",
      "state": "NotApplicable"
    },
    {
      "explanation": "remote executable dependencies are content-addressed",
      "id": "WV-SUPPLY-001",
      "state": "NotApplicable"
    },
    {
      "explanation": "untrusted checkout selection cannot race a privileged consumer",
      "id": "WV-TOCTOU-001",
      "state": "NotApplicable"
    }
  ],
  "providers": [
    "azure-semantic-v1"
  ],
  "schema": "workflow-verifier-report/1",
  "summary": {
    "diagnostics": 0,
    "edges": 5,
    "nodes": 6,
    "properties": 12,
    "sources": 1,
    "unknown_properties": 0,
    "violated_properties": 0
  },
  "tool": {
    "commit": null,
    "compiler": "rustc 1.98.0 (88d9e12ae 2026-08-18)",
    "name": "workflow-verifier",
    "target": "x86_64-unknown-linux-gnu",
    "version": "0.1.0"
  }
}
