{
  "analysis_digest": "sha256:e6d132098058ae1a41b7bcb0ce6864f0040e9f0cede1924f2d6a97c44b3e0fb3",
  "completeness": {
    "reasons": [
      "Incomplete.Static_analysis",
      "Incomplete.Unbound_build_source_commit",
      "Incomplete.Unresolved_dependency: azure/stages.yml@templates",
      "Incomplete.Unresolved_dependency: crate-ci/azure-pipelines"
    ],
    "state": "incomplete"
  },
  "diagnostics": [],
  "digest": "sha256:5c4608d6ab969386451aa5cb6a65b3fd23faf6115d573b03fd161405bf3d4c9d",
  "gate": {
    "exit_code": 0,
    "result": "pass"
  },
  "inputs": {
    "config": {
      "digest": "sha256:e3b0c44298fc1c149afbf4c8996fb92427ae41e4649b934ca495991b7852b855",
      "origin": "built-in",
      "trust": "built-in"
    },
    "lock": {
      "digest": "sha256:e3b0c44298fc1c149afbf4c8996fb92427ae41e4649b934ca495991b7852b855"
    },
    "manifest_digest": "sha256:7363aafd8fef75127a5fb976ea4bd593b32d81bac347616295e501c7a6e285b8",
    "sources": [
      {
        "digest": "sha256:25bbfbeb9c483819c7db263b31e9dcf0865d067ce48f0cc144ca2533a44be0c9",
        "id": 0,
        "path": "azure-pipelines.yml"
      }
    ]
  },
  "persona": "audit",
  "properties": [
    {
      "explanation": "AI agent input is trusted or isolated from tools and network",
      "id": "WV-AI-001",
      "state": "NotApplicable"
    },
    {
      "explanation": "artifact integrity is preserved across producers and consumers",
      "id": "WV-ARTIFACT-001",
      "state": "NotApplicable"
    },
    {
      "explanation": "every privileged effect is dominated by an authorization gate",
      "id": "WV-AUTH-001",
      "state": "NotApplicable"
    },
    {
      "explanation": "cache integrity is preserved across producers and consumers",
      "id": "WV-CACHE-001",
      "state": "NotApplicable"
    },
    {
      "explanation": "the lowered graph is well-formed, phase-valid, and acyclic",
      "id": "WV-CORRECT-001",
      "state": "Proved"
    },
    {
      "explanation": "credentials do not persist into reusable runner state",
      "id": "WV-CRED-001",
      "state": "NotApplicable"
    },
    {
      "explanation": "granted capabilities are required by a reachable effect",
      "id": "WV-PERM-001",
      "state": "NotApplicable"
    },
    {
      "explanation": "untrusted values do not cross an unquoted command boundary",
      "id": "WV-SEC-001",
      "state": "NotApplicable"
    },
    {
      "explanation": "secret values do not reach network, output, or logging effects",
      "id": "WV-SEC-002",
      "reasons": [
        {
          "detail": "crate-ci/azure-pipelines",
          "kind": "unresolved_dependency"
        }
      ],
      "state": "Unknown"
    },
    {
      "explanation": "workflow execution cannot rewrite trusted CI definitions",
      "id": "WV-SELF-001",
      "state": "NotApplicable"
    },
    {
      "explanation": "remote executable dependencies are content-addressed",
      "id": "WV-SUPPLY-001",
      "reasons": [
        {
          "detail": "crate-ci/azure-pipelines",
          "kind": "unresolved_dependency"
        }
      ],
      "state": "Unknown"
    },
    {
      "explanation": "untrusted checkout selection cannot race a privileged consumer",
      "id": "WV-TOCTOU-001",
      "state": "NotApplicable"
    }
  ],
  "providers": [
    "azure-semantic-v1"
  ],
  "schema": "workflow-verifier-report/1",
  "summary": {
    "diagnostics": 0,
    "edges": 5,
    "nodes": 5,
    "properties": 12,
    "sources": 1,
    "unknown_properties": 2,
    "violated_properties": 0
  },
  "tool": {
    "commit": null,
    "compiler": "rustc 1.98.0 (88d9e12ae 2026-08-18)",
    "name": "workflow-verifier",
    "target": "x86_64-unknown-linux-gnu",
    "version": "0.1.0"
  }
}
