{
  "analysis_digest": "sha256:cbf62c2f90970525c70459d44a8b4dd1acf6998d082ff4686df9e9841e8c1b82",
  "completeness": {
    "reasons": [
      "Incomplete.Static_analysis",
      "Incomplete.Unbound_build_source_commit",
      "Incomplete.Unresolved_dependency: circleci/node:12",
      "Incomplete.Unresolved_dependency: nikolaik/python-nodejs:python3.7-nodejs12"
    ],
    "state": "incomplete"
  },
  "diagnostics": [],
  "digest": "sha256:6a19702c3ae9fe5af9ad83a8f2c37c847b7d4d1e1beb2dcd1a6750633cb211a9",
  "gate": {
    "exit_code": 0,
    "result": "pass"
  },
  "inputs": {
    "config": {
      "digest": "sha256:e3b0c44298fc1c149afbf4c8996fb92427ae41e4649b934ca495991b7852b855",
      "origin": "built-in",
      "trust": "built-in"
    },
    "lock": {
      "digest": "sha256:e3b0c44298fc1c149afbf4c8996fb92427ae41e4649b934ca495991b7852b855"
    },
    "manifest_digest": "sha256:db986adbd6e4723e6e6732780ba67301db37029aafd7639c025cef5eefa0f8ae",
    "sources": [
      {
        "digest": "sha256:2d3b4e1c8cc7b26d9fc0eca54019169a292d43fea6c7c428345df2e11932a2fb",
        "id": 0,
        "path": ".circleci/config.yml"
      }
    ]
  },
  "persona": "audit",
  "properties": [
    {
      "explanation": "AI agent input is trusted or isolated from tools and network",
      "id": "WV-AI-001",
      "state": "NotApplicable"
    },
    {
      "explanation": "artifact integrity is preserved across producers and consumers",
      "id": "WV-ARTIFACT-001",
      "state": "NotApplicable"
    },
    {
      "explanation": "every privileged effect is dominated by an authorization gate",
      "id": "WV-AUTH-001",
      "state": "NotApplicable"
    },
    {
      "explanation": "cache integrity is preserved across producers and consumers",
      "id": "WV-CACHE-001",
      "state": "NotApplicable"
    },
    {
      "explanation": "the lowered graph is well-formed, phase-valid, and acyclic",
      "id": "WV-CORRECT-001",
      "state": "Proved"
    },
    {
      "explanation": "credentials do not persist into reusable runner state",
      "id": "WV-CRED-001",
      "state": "NotApplicable"
    },
    {
      "explanation": "granted capabilities are required by a reachable effect",
      "id": "WV-PERM-001",
      "state": "NotApplicable"
    },
    {
      "explanation": "untrusted values do not cross an unquoted command boundary",
      "id": "WV-SEC-001",
      "state": "Proved"
    },
    {
      "explanation": "secret values do not reach network, output, or logging effects",
      "id": "WV-SEC-002",
      "state": "Proved"
    },
    {
      "explanation": "workflow execution cannot rewrite trusted CI definitions",
      "id": "WV-SELF-001",
      "state": "NotApplicable"
    },
    {
      "explanation": "remote executable dependencies are content-addressed",
      "id": "WV-SUPPLY-001",
      "reasons": [
        {
          "detail": "builtin:add_ssh_keys",
          "kind": "unresolved_dependency"
        },
        {
          "detail": "builtin:checkout",
          "kind": "unresolved_dependency"
        },
        {
          "detail": "circleci/node:12",
          "kind": "unresolved_dependency"
        },
        {
          "detail": "nikolaik/python-nodejs:python3.7-nodejs12",
          "kind": "unresolved_dependency"
        }
      ],
      "state": "Unknown"
    },
    {
      "explanation": "untrusted checkout selection cannot race a privileged consumer",
      "id": "WV-TOCTOU-001",
      "state": "Proved"
    }
  ],
  "providers": [
    "circleci-semantic-v1"
  ],
  "schema": "workflow-verifier-report/1",
  "summary": {
    "diagnostics": 0,
    "edges": 72,
    "nodes": 49,
    "properties": 12,
    "sources": 1,
    "unknown_properties": 1,
    "violated_properties": 0
  },
  "tool": {
    "commit": null,
    "compiler": "rustc 1.98.0 (88d9e12ae 2026-08-18)",
    "name": "workflow-verifier",
    "target": "x86_64-unknown-linux-gnu",
    "version": "0.1.0"
  }
}
