{
  "analysis_digest": "sha256:6ca5c5ea9f25b35dce25fec5761f618863e20f6ce96fbf778324e8a9f017c7ad",
  "completeness": {
    "reasons": [
      "Incomplete.Static_analysis",
      "Incomplete.Unbound_build_source_commit",
      "Incomplete.Unresolved_dependency: docker:latest"
    ],
    "state": "incomplete"
  },
  "diagnostics": [
    {
      "capabilities": [
        "secret_access",
        "network",
        "shell"
      ],
      "confidence": "high",
      "evidence": [
        "abstract secrecy = secret",
        "script effect = network_request"
      ],
      "id": "diag_ac768d7b0fd2f8b15d732b954f628781008a5f1e72496c05c9aa0e47c171934d",
      "message": "a secret reaches a network-capable command",
      "rule_id": "WV-SEC-002",
      "severity": "critical",
      "span": {
        "source": 0,
        "start": {
          "byte": 47,
          "column": 9,
          "line": 5
        },
        "stop": {
          "byte": 108,
          "column": 70,
          "line": 5
        }
      },
      "trace": [
        {
          "label": "command sink contains untrusted data",
          "node": 9,
          "span": {
            "source": 0,
            "start": {
              "byte": 47,
              "column": 9,
              "line": 5
            },
            "stop": {
              "byte": 108,
              "column": 70,
              "line": 5
            }
          }
        }
      ]
    }
  ],
  "digest": "sha256:e3a5a5ffdf5458eb957e2f47bb0f2da60e2703e6bc776aab4719173e1900b55a",
  "gate": {
    "exit_code": 0,
    "result": "pass"
  },
  "inputs": {
    "config": {
      "digest": "sha256:e3b0c44298fc1c149afbf4c8996fb92427ae41e4649b934ca495991b7852b855",
      "origin": "built-in",
      "trust": "built-in"
    },
    "lock": {
      "digest": "sha256:e3b0c44298fc1c149afbf4c8996fb92427ae41e4649b934ca495991b7852b855"
    },
    "manifest_digest": "sha256:aa789ec5f63d5ec31ce0a83d7bea718a0b2fe815a5aecfd53cb8c363a68686b1",
    "sources": [
      {
        "digest": "sha256:ff2bed3b69bd3dd4aa5e7a228e098cb42ae298c77495e1ddfdf9769bf528cec3",
        "id": 0,
        "path": ".gitlab-ci.yml"
      }
    ]
  },
  "persona": "audit",
  "properties": [
    {
      "explanation": "AI agent input is trusted or isolated from tools and network",
      "id": "WV-AI-001",
      "state": "NotApplicable"
    },
    {
      "explanation": "artifact integrity is preserved across producers and consumers",
      "id": "WV-ARTIFACT-001",
      "state": "NotApplicable"
    },
    {
      "explanation": "every privileged effect is dominated by an authorization gate",
      "id": "WV-AUTH-001",
      "state": "NotApplicable"
    },
    {
      "explanation": "cache integrity is preserved across producers and consumers",
      "id": "WV-CACHE-001",
      "state": "NotApplicable"
    },
    {
      "explanation": "the lowered graph is well-formed, phase-valid, and acyclic",
      "id": "WV-CORRECT-001",
      "state": "Proved"
    },
    {
      "explanation": "credentials do not persist into reusable runner state",
      "id": "WV-CRED-001",
      "state": "NotApplicable"
    },
    {
      "explanation": "granted capabilities are required by a reachable effect",
      "id": "WV-PERM-001",
      "state": "NotApplicable"
    },
    {
      "explanation": "untrusted values do not cross an unquoted command boundary",
      "id": "WV-SEC-001",
      "state": "Proved"
    },
    {
      "explanation": "secret values do not reach network, output, or logging effects",
      "id": "WV-SEC-002",
      "state": "Violated"
    },
    {
      "explanation": "workflow execution cannot rewrite trusted CI definitions",
      "id": "WV-SELF-001",
      "state": "NotApplicable"
    },
    {
      "explanation": "remote executable dependencies are content-addressed",
      "id": "WV-SUPPLY-001",
      "reasons": [
        {
          "detail": "docker:latest",
          "kind": "unresolved_dependency"
        }
      ],
      "state": "Unknown"
    },
    {
      "explanation": "untrusted checkout selection cannot race a privileged consumer",
      "id": "WV-TOCTOU-001",
      "state": "NotApplicable"
    }
  ],
  "providers": [
    "gitlab-semantic-v1"
  ],
  "schema": "workflow-verifier-report/1",
  "summary": {
    "diagnostics": 1,
    "edges": 22,
    "nodes": 20,
    "properties": 12,
    "sources": 1,
    "unknown_properties": 1,
    "violated_properties": 1
  },
  "tool": {
    "commit": null,
    "compiler": "rustc 1.98.0 (88d9e12ae 2026-08-18)",
    "name": "workflow-verifier",
    "target": "x86_64-unknown-linux-gnu",
    "version": "0.1.0"
  }
}
