{
  "analysis_digest": "sha256:008472298ec330bb1516ad471ad175d1936b125b55e0bb57eda3f65318e22784",
  "completeness": {
    "reasons": [
      "Incomplete.Static_analysis",
      "Incomplete.Unbound_build_source_commit",
      "Incomplete.Unresolved_dependency: coveralls/coveralls@1.0.6",
      "Incomplete.Unresolved_dependency: ubuntu-2004:202101-01"
    ],
    "state": "incomplete"
  },
  "diagnostics": [
    {
      "confidence": "high",
      "evidence": [
        "reference = coveralls/coveralls@1.0.6"
      ],
      "fix": {
        "description": "resolve and replace the reference with an immutable revision",
        "kind": "pin-dependency",
        "span": {
          "source": 0,
          "start": {
            "byte": 32,
            "column": 14,
            "line": 3
          },
          "stop": {
            "byte": 57,
            "column": 39,
            "line": 3
          }
        }
      },
      "id": "diag_577f806a04195c10e79f1a3bb0482539f686260387e5b7d4b6c25b94c185b088",
      "message": "dependency is not pinned to immutable content: coveralls/coveralls@1.0.6",
      "rule_id": "WV-SUPPLY-001",
      "severity": "warning",
      "span": {
        "source": 0,
        "start": {
          "byte": 32,
          "column": 14,
          "line": 3
        },
        "stop": {
          "byte": 57,
          "column": 39,
          "line": 3
        }
      },
      "trace": [
        {
          "label": "mutable dependency",
          "node": 1,
          "span": {
            "source": 0,
            "start": {
              "byte": 32,
              "column": 14,
              "line": 3
            },
            "stop": {
              "byte": 57,
              "column": 39,
              "line": 3
            }
          }
        }
      ]
    }
  ],
  "digest": "sha256:afb2a6d18b06a508c8a5058480e6cc8101c0f5f9056d32659c260a6e1eb991b5",
  "gate": {
    "exit_code": 0,
    "result": "pass"
  },
  "inputs": {
    "config": {
      "digest": "sha256:e3b0c44298fc1c149afbf4c8996fb92427ae41e4649b934ca495991b7852b855",
      "origin": "built-in",
      "trust": "built-in"
    },
    "lock": {
      "digest": "sha256:e3b0c44298fc1c149afbf4c8996fb92427ae41e4649b934ca495991b7852b855"
    },
    "manifest_digest": "sha256:8b8b7b2f9f3c380763a0f603867c30a439fa811286c3c86a49edfc314bf43518",
    "sources": [
      {
        "digest": "sha256:9facfe9cdf83f7bcfec71af98eb4bb2b1a17a2329776d8855defcb24d1fec7ee",
        "id": 0,
        "path": ".circleci/config.yml"
      }
    ]
  },
  "persona": "audit",
  "properties": [
    {
      "explanation": "AI agent input is trusted or isolated from tools and network",
      "id": "WV-AI-001",
      "state": "NotApplicable"
    },
    {
      "explanation": "artifact integrity is preserved across producers and consumers",
      "id": "WV-ARTIFACT-001",
      "state": "NotApplicable"
    },
    {
      "explanation": "every privileged effect is dominated by an authorization gate",
      "id": "WV-AUTH-001",
      "state": "NotApplicable"
    },
    {
      "explanation": "cache integrity is preserved across producers and consumers",
      "id": "WV-CACHE-001",
      "state": "NotApplicable"
    },
    {
      "explanation": "the lowered graph is well-formed, phase-valid, and acyclic",
      "id": "WV-CORRECT-001",
      "state": "Proved"
    },
    {
      "explanation": "credentials do not persist into reusable runner state",
      "id": "WV-CRED-001",
      "state": "NotApplicable"
    },
    {
      "explanation": "granted capabilities are required by a reachable effect",
      "id": "WV-PERM-001",
      "state": "NotApplicable"
    },
    {
      "explanation": "untrusted values do not cross an unquoted command boundary",
      "id": "WV-SEC-001",
      "state": "Proved"
    },
    {
      "explanation": "secret values do not reach network, output, or logging effects",
      "id": "WV-SEC-002",
      "state": "Proved"
    },
    {
      "explanation": "workflow execution cannot rewrite trusted CI definitions",
      "id": "WV-SELF-001",
      "state": "NotApplicable"
    },
    {
      "explanation": "remote executable dependencies are content-addressed",
      "id": "WV-SUPPLY-001",
      "state": "Violated"
    },
    {
      "explanation": "untrusted checkout selection cannot race a privileged consumer",
      "id": "WV-TOCTOU-001",
      "state": "Proved"
    }
  ],
  "providers": [
    "circleci-semantic-v1"
  ],
  "schema": "workflow-verifier-report/1",
  "summary": {
    "diagnostics": 1,
    "edges": 46,
    "nodes": 30,
    "properties": 12,
    "sources": 1,
    "unknown_properties": 0,
    "violated_properties": 1
  },
  "tool": {
    "commit": null,
    "compiler": "rustc 1.98.0 (88d9e12ae 2026-08-18)",
    "name": "workflow-verifier",
    "target": "x86_64-unknown-linux-gnu",
    "version": "0.1.0"
  }
}
