{
  "analysis_digest": "sha256:8b9688fd7d19ba991003b1a675eb06db6c823132f2a9dc6696d4684ece69766e",
  "completeness": {
    "reasons": [
      "Incomplete.Static_analysis",
      "Incomplete.Unbound_build_source_commit",
      "Incomplete.Unresolved_dependency: $SKA_K8S_TOOLS_BUILD_DEPLOY",
      "Incomplete.Unresolved_dependency: $SKA_K8S_TOOLS_DOCKER_BUILDER_IMAGE",
      "Incomplete.Unresolved_dependency: ska-telescope/templates-repository:gitlab-ci/includes/docs-pages.gitlab-ci.yml",
      "Incomplete.Unresolved_dependency: ska-telescope/templates-repository:gitlab-ci/includes/docs.gitlab-ci.yml",
      "Incomplete.Unresolved_dependency: ska-telescope/templates-repository:gitlab-ci/includes/finaliser.gitlab-ci.yml",
      "Incomplete.Unresolved_dependency: ska-telescope/templates-repository:gitlab-ci/includes/helm-chart.gitlab-ci.yml",
      "Incomplete.Unresolved_dependency: ska-telescope/templates-repository:gitlab-ci/includes/python-lint.gitlab-ci.yml",
      "Incomplete.Unresolved_dependency: ska-telescope/templates-repository:gitlab-ci/includes/release.gitlab-ci.yml"
    ],
    "state": "incomplete"
  },
  "diagnostics": [
    {
      "confidence": "high",
      "evidence": [
        "frontend compiler"
      ],
      "id": "diag_1af82f7ebad294bd600e3d4a872f07e694e652418e51cbf44dbec9f79d404949",
      "message": "python-lint-low extends unknown python-lint",
      "rule_id": "GL-UNKNOWN-EXTENDS",
      "severity": "error",
      "span": {
        "source": 0,
        "start": {
          "byte": 1180,
          "column": 1,
          "line": 46
        },
        "stop": {
          "byte": 1257,
          "column": 25,
          "line": 49
        }
      }
    }
  ],
  "digest": "sha256:6ee2a186e7b33392cd65c992ec41f0200d6a4affc77d83bced6587aa75093872",
  "gate": {
    "exit_code": 0,
    "result": "pass"
  },
  "inputs": {
    "config": {
      "digest": "sha256:e3b0c44298fc1c149afbf4c8996fb92427ae41e4649b934ca495991b7852b855",
      "origin": "built-in",
      "trust": "built-in"
    },
    "lock": {
      "digest": "sha256:e3b0c44298fc1c149afbf4c8996fb92427ae41e4649b934ca495991b7852b855"
    },
    "manifest_digest": "sha256:c5d033e5d49ee4029c59f6ad1dac48c31c366d2a34517e37d8b725bd150f3081",
    "sources": [
      {
        "digest": "sha256:a604b6066c43ee6e4442fbe7e713d80e3c52bbb631c896a99c36d5c323dcd274",
        "id": 0,
        "path": ".gitlab-ci.yml"
      }
    ]
  },
  "persona": "audit",
  "properties": [
    {
      "explanation": "AI agent input is trusted or isolated from tools and network",
      "id": "WV-AI-001",
      "state": "NotApplicable"
    },
    {
      "explanation": "artifact integrity is preserved across producers and consumers",
      "id": "WV-ARTIFACT-001",
      "state": "Proved"
    },
    {
      "explanation": "every privileged effect is dominated by an authorization gate",
      "id": "WV-AUTH-001",
      "reasons": [
        {
          "detail": "protection rules for environment:test/low-$CI_COMMIT_REF_SLUG",
          "kind": "external_state"
        },
        {
          "detail": "protection rules for environment:test/mid-$CI_COMMIT_REF_SLUG",
          "kind": "external_state"
        }
      ],
      "state": "Unknown"
    },
    {
      "explanation": "cache integrity is preserved across producers and consumers",
      "id": "WV-CACHE-001",
      "state": "NotApplicable"
    },
    {
      "explanation": "the lowered graph is well-formed, phase-valid, and acyclic",
      "id": "WV-CORRECT-001",
      "state": "Proved"
    },
    {
      "explanation": "credentials do not persist into reusable runner state",
      "id": "WV-CRED-001",
      "state": "NotApplicable"
    },
    {
      "explanation": "granted capabilities are required by a reachable effect",
      "id": "WV-PERM-001",
      "state": "Proved"
    },
    {
      "explanation": "untrusted values do not cross an unquoted command boundary",
      "id": "WV-SEC-001",
      "state": "Proved"
    },
    {
      "explanation": "secret values do not reach network, output, or logging effects",
      "id": "WV-SEC-002",
      "state": "Proved"
    },
    {
      "explanation": "workflow execution cannot rewrite trusted CI definitions",
      "id": "WV-SELF-001",
      "state": "NotApplicable"
    },
    {
      "explanation": "remote executable dependencies are content-addressed",
      "id": "WV-SUPPLY-001",
      "reasons": [
        {
          "detail": "$SKA_K8S_TOOLS_BUILD_DEPLOY",
          "kind": "unresolved_dependency"
        },
        {
          "detail": "$SKA_K8S_TOOLS_DOCKER_BUILDER_IMAGE",
          "kind": "unresolved_dependency"
        },
        {
          "detail": "extends:python-lint",
          "kind": "unresolved_dependency"
        },
        {
          "detail": "ska-telescope/templates-repository:gitlab-ci/includes/docs-pages.gitlab-ci.yml",
          "kind": "unresolved_dependency"
        },
        {
          "detail": "ska-telescope/templates-repository:gitlab-ci/includes/docs.gitlab-ci.yml",
          "kind": "unresolved_dependency"
        },
        {
          "detail": "ska-telescope/templates-repository:gitlab-ci/includes/finaliser.gitlab-ci.yml",
          "kind": "unresolved_dependency"
        },
        {
          "detail": "ska-telescope/templates-repository:gitlab-ci/includes/helm-chart.gitlab-ci.yml",
          "kind": "unresolved_dependency"
        },
        {
          "detail": "ska-telescope/templates-repository:gitlab-ci/includes/python-lint.gitlab-ci.yml",
          "kind": "unresolved_dependency"
        },
        {
          "detail": "ska-telescope/templates-repository:gitlab-ci/includes/release.gitlab-ci.yml",
          "kind": "unresolved_dependency"
        }
      ],
      "state": "Unknown"
    },
    {
      "explanation": "untrusted checkout selection cannot race a privileged consumer",
      "id": "WV-TOCTOU-001",
      "state": "NotApplicable"
    }
  ],
  "providers": [
    "gitlab-semantic-v1"
  ],
  "schema": "workflow-verifier-report/1",
  "summary": {
    "diagnostics": 1,
    "edges": 239,
    "nodes": 215,
    "properties": 12,
    "sources": 1,
    "unknown_properties": 2,
    "violated_properties": 0
  },
  "tool": {
    "commit": null,
    "compiler": "rustc 1.98.0 (88d9e12ae 2026-08-18)",
    "name": "workflow-verifier",
    "target": "x86_64-unknown-linux-gnu",
    "version": "0.1.0"
  }
}
