{
  "analysis_digest": "sha256:b8c216556e8eecc4bb405626853ad6264c4b598f4815e00f19d08c1afdf24f35",
  "completeness": {
    "reasons": [
      "Incomplete.Static_analysis",
      "Incomplete.Unbound_build_source_commit",
      "Incomplete.Unresolved_dependency: CopyFiles@2",
      "Incomplete.Unresolved_dependency: NodeTool@0",
      "Incomplete.Unresolved_dependency: PublishBuildArtifacts@1"
    ],
    "state": "incomplete"
  },
  "diagnostics": [
    {
      "confidence": "high",
      "evidence": [
        "reference = NodeTool@0"
      ],
      "fix": {
        "description": "resolve and replace the reference with an immutable revision",
        "kind": "pin-dependency",
        "span": {
          "source": 0,
          "start": {
            "byte": 277,
            "column": 9,
            "line": 13
          },
          "stop": {
            "byte": 287,
            "column": 19,
            "line": 13
          }
        }
      },
      "id": "diag_bbadeffec74ae869c05d6ef30786edfa66c5c4770cf9b0d10ebf01f44eb686cd",
      "message": "dependency is not pinned to immutable content: NodeTool@0",
      "rule_id": "WV-SUPPLY-001",
      "severity": "warning",
      "span": {
        "source": 0,
        "start": {
          "byte": 277,
          "column": 9,
          "line": 13
        },
        "stop": {
          "byte": 287,
          "column": 19,
          "line": 13
        }
      },
      "trace": [
        {
          "label": "mutable dependency",
          "node": 4,
          "span": {
            "source": 0,
            "start": {
              "byte": 277,
              "column": 9,
              "line": 13
            },
            "stop": {
              "byte": 287,
              "column": 19,
              "line": 13
            }
          }
        }
      ]
    },
    {
      "confidence": "high",
      "evidence": [
        "reference = CopyFiles@2"
      ],
      "fix": {
        "description": "resolve and replace the reference with an immutable revision",
        "kind": "pin-dependency",
        "span": {
          "source": 0,
          "start": {
            "byte": 450,
            "column": 9,
            "line": 23
          },
          "stop": {
            "byte": 461,
            "column": 20,
            "line": 23
          }
        }
      },
      "id": "diag_e4c6b592846d3e7eecf3ed63dedbbabb669383f84f252237023ce5775f491d86",
      "message": "dependency is not pinned to immutable content: CopyFiles@2",
      "rule_id": "WV-SUPPLY-001",
      "severity": "warning",
      "span": {
        "source": 0,
        "start": {
          "byte": 450,
          "column": 9,
          "line": 23
        },
        "stop": {
          "byte": 461,
          "column": 20,
          "line": 23
        }
      },
      "trace": [
        {
          "label": "mutable dependency",
          "node": 8,
          "span": {
            "source": 0,
            "start": {
              "byte": 450,
              "column": 9,
              "line": 23
            },
            "stop": {
              "byte": 461,
              "column": 20,
              "line": 23
            }
          }
        }
      ]
    },
    {
      "confidence": "high",
      "evidence": [
        "reference = PublishBuildArtifacts@1"
      ],
      "fix": {
        "description": "resolve and replace the reference with an immutable revision",
        "kind": "pin-dependency",
        "span": {
          "source": 0,
          "start": {
            "byte": 629,
            "column": 9,
            "line": 29
          },
          "stop": {
            "byte": 652,
            "column": 32,
            "line": 29
          }
        }
      },
      "id": "diag_b336f0cf69bd3e5e67c3ec43f0475124ce8e1195ba9f1751512599a919c6c1d6",
      "message": "dependency is not pinned to immutable content: PublishBuildArtifacts@1",
      "rule_id": "WV-SUPPLY-001",
      "severity": "warning",
      "span": {
        "source": 0,
        "start": {
          "byte": 629,
          "column": 9,
          "line": 29
        },
        "stop": {
          "byte": 652,
          "column": 32,
          "line": 29
        }
      },
      "trace": [
        {
          "label": "mutable dependency",
          "node": 10,
          "span": {
            "source": 0,
            "start": {
              "byte": 629,
              "column": 9,
              "line": 29
            },
            "stop": {
              "byte": 652,
              "column": 32,
              "line": 29
            }
          }
        }
      ]
    }
  ],
  "digest": "sha256:df59d75c6da11098606d573d637da49d86505bce15ec5eda6174bff2eaf1171c",
  "gate": {
    "exit_code": 0,
    "result": "pass"
  },
  "inputs": {
    "config": {
      "digest": "sha256:e3b0c44298fc1c149afbf4c8996fb92427ae41e4649b934ca495991b7852b855",
      "origin": "built-in",
      "trust": "built-in"
    },
    "lock": {
      "digest": "sha256:e3b0c44298fc1c149afbf4c8996fb92427ae41e4649b934ca495991b7852b855"
    },
    "manifest_digest": "sha256:b0609fa929dea85d3eed538b9fce0ff72d41fed46b900cd5ae8ecc0775d0e715",
    "sources": [
      {
        "digest": "sha256:cac11dadb516b48a6b770b7b5a9bf0035d71ad270530483af33af670348e89b2",
        "id": 0,
        "path": "azure-pipelines.yml"
      }
    ]
  },
  "persona": "audit",
  "properties": [
    {
      "explanation": "AI agent input is trusted or isolated from tools and network",
      "id": "WV-AI-001",
      "state": "NotApplicable"
    },
    {
      "explanation": "artifact integrity is preserved across producers and consumers",
      "id": "WV-ARTIFACT-001",
      "state": "NotApplicable"
    },
    {
      "explanation": "every privileged effect is dominated by an authorization gate",
      "id": "WV-AUTH-001",
      "state": "NotApplicable"
    },
    {
      "explanation": "cache integrity is preserved across producers and consumers",
      "id": "WV-CACHE-001",
      "state": "NotApplicable"
    },
    {
      "explanation": "the lowered graph is well-formed, phase-valid, and acyclic",
      "id": "WV-CORRECT-001",
      "state": "Proved"
    },
    {
      "explanation": "credentials do not persist into reusable runner state",
      "id": "WV-CRED-001",
      "state": "NotApplicable"
    },
    {
      "explanation": "granted capabilities are required by a reachable effect",
      "id": "WV-PERM-001",
      "state": "NotApplicable"
    },
    {
      "explanation": "untrusted values do not cross an unquoted command boundary",
      "id": "WV-SEC-001",
      "state": "Proved"
    },
    {
      "explanation": "secret values do not reach network, output, or logging effects",
      "id": "WV-SEC-002",
      "reasons": [
        {
          "detail": "PublishBuildArtifacts@1",
          "kind": "unresolved_dependency"
        }
      ],
      "state": "Unknown"
    },
    {
      "explanation": "workflow execution cannot rewrite trusted CI definitions",
      "id": "WV-SELF-001",
      "state": "NotApplicable"
    },
    {
      "explanation": "remote executable dependencies are content-addressed",
      "id": "WV-SUPPLY-001",
      "state": "Violated"
    },
    {
      "explanation": "untrusted checkout selection cannot race a privileged consumer",
      "id": "WV-TOCTOU-001",
      "state": "NotApplicable"
    }
  ],
  "providers": [
    "azure-semantic-v1"
  ],
  "schema": "workflow-verifier-report/1",
  "summary": {
    "diagnostics": 3,
    "edges": 16,
    "nodes": 11,
    "properties": 12,
    "sources": 1,
    "unknown_properties": 1,
    "violated_properties": 1
  },
  "tool": {
    "commit": null,
    "compiler": "rustc 1.98.0 (88d9e12ae 2026-08-18)",
    "name": "workflow-verifier",
    "target": "x86_64-unknown-linux-gnu",
    "version": "0.1.0"
  }
}
