{
  "analysis_digest": "sha256:468da61278622dcf5c0a8122f0835e2cc32a8b56087930292b9a2426e11ca977",
  "completeness": {
    "reasons": [
      "Incomplete.Static_analysis",
      "Incomplete.Unbound_build_source_commit",
      "Incomplete.Unresolved_dependency: NuGetCommand@2",
      "Incomplete.Unresolved_dependency: NuGetToolInstaller@0",
      "Incomplete.Unresolved_dependency: VSBuild@1"
    ],
    "state": "incomplete"
  },
  "diagnostics": [
    {
      "confidence": "high",
      "evidence": [
        "reference = NuGetToolInstaller@0"
      ],
      "fix": {
        "description": "resolve and replace the reference with an immutable revision",
        "kind": "pin-dependency",
        "span": {
          "source": 0,
          "start": {
            "byte": 375,
            "column": 9,
            "line": 15
          },
          "stop": {
            "byte": 395,
            "column": 29,
            "line": 15
          }
        }
      },
      "id": "diag_3969d4892dfef44e882d9d888296fbcf0e42f9d8142c3780b3bfd36c6838c054",
      "message": "dependency is not pinned to immutable content: NuGetToolInstaller@0",
      "rule_id": "WV-SUPPLY-001",
      "severity": "warning",
      "span": {
        "source": 0,
        "start": {
          "byte": 375,
          "column": 9,
          "line": 15
        },
        "stop": {
          "byte": 395,
          "column": 29,
          "line": 15
        }
      },
      "trace": [
        {
          "label": "mutable dependency",
          "node": 6,
          "span": {
            "source": 0,
            "start": {
              "byte": 375,
              "column": 9,
              "line": 15
            },
            "stop": {
              "byte": 395,
              "column": 29,
              "line": 15
            }
          }
        }
      ]
    },
    {
      "confidence": "high",
      "evidence": [
        "reference = NuGetCommand@2"
      ],
      "fix": {
        "description": "resolve and replace the reference with an immutable revision",
        "kind": "pin-dependency",
        "span": {
          "source": 0,
          "start": {
            "byte": 405,
            "column": 9,
            "line": 17
          },
          "stop": {
            "byte": 419,
            "column": 23,
            "line": 17
          }
        }
      },
      "id": "diag_03ee8546b43cb0b4f0507b8fe0a538efdcc0c9fb9b9544e6b1041a4a32b89204",
      "message": "dependency is not pinned to immutable content: NuGetCommand@2",
      "rule_id": "WV-SUPPLY-001",
      "severity": "warning",
      "span": {
        "source": 0,
        "start": {
          "byte": 405,
          "column": 9,
          "line": 17
        },
        "stop": {
          "byte": 419,
          "column": 23,
          "line": 17
        }
      },
      "trace": [
        {
          "label": "mutable dependency",
          "node": 8,
          "span": {
            "source": 0,
            "start": {
              "byte": 405,
              "column": 9,
              "line": 17
            },
            "stop": {
              "byte": 419,
              "column": 23,
              "line": 17
            }
          }
        }
      ]
    },
    {
      "confidence": "high",
      "evidence": [
        "reference = VSBuild@1"
      ],
      "fix": {
        "description": "resolve and replace the reference with an immutable revision",
        "kind": "pin-dependency",
        "span": {
          "source": 0,
          "start": {
            "byte": 474,
            "column": 9,
            "line": 21
          },
          "stop": {
            "byte": 483,
            "column": 18,
            "line": 21
          }
        }
      },
      "id": "diag_faea214b07e633e12e0ec58c83a31c2ee7b4b6b3fb1bac940f8ae772c45a2d03",
      "message": "dependency is not pinned to immutable content: VSBuild@1",
      "rule_id": "WV-SUPPLY-001",
      "severity": "warning",
      "span": {
        "source": 0,
        "start": {
          "byte": 474,
          "column": 9,
          "line": 21
        },
        "stop": {
          "byte": 483,
          "column": 18,
          "line": 21
        }
      },
      "trace": [
        {
          "label": "mutable dependency",
          "node": 10,
          "span": {
            "source": 0,
            "start": {
              "byte": 474,
              "column": 9,
              "line": 21
            },
            "stop": {
              "byte": 483,
              "column": 18,
              "line": 21
            }
          }
        }
      ]
    }
  ],
  "digest": "sha256:32fe04a41e6528df2a7f26700dc290dba0d5fc852c40f1a4551ef5b38978295d",
  "gate": {
    "exit_code": 0,
    "result": "pass"
  },
  "inputs": {
    "config": {
      "digest": "sha256:e3b0c44298fc1c149afbf4c8996fb92427ae41e4649b934ca495991b7852b855",
      "origin": "built-in",
      "trust": "built-in"
    },
    "lock": {
      "digest": "sha256:e3b0c44298fc1c149afbf4c8996fb92427ae41e4649b934ca495991b7852b855"
    },
    "manifest_digest": "sha256:b3b7ad20b3682dea3d5e94bab3393efa1d81290634473875024b79af9bab2a04",
    "sources": [
      {
        "digest": "sha256:37828d0a4e2ba5b1ee960c8f9788732f343087db63ee345478b2f92f71b77dce",
        "id": 0,
        "path": "azure-pipelines.yml"
      }
    ]
  },
  "persona": "audit",
  "properties": [
    {
      "explanation": "AI agent input is trusted or isolated from tools and network",
      "id": "WV-AI-001",
      "state": "NotApplicable"
    },
    {
      "explanation": "artifact integrity is preserved across producers and consumers",
      "id": "WV-ARTIFACT-001",
      "state": "NotApplicable"
    },
    {
      "explanation": "every privileged effect is dominated by an authorization gate",
      "id": "WV-AUTH-001",
      "state": "NotApplicable"
    },
    {
      "explanation": "cache integrity is preserved across producers and consumers",
      "id": "WV-CACHE-001",
      "state": "NotApplicable"
    },
    {
      "explanation": "the lowered graph is well-formed, phase-valid, and acyclic",
      "id": "WV-CORRECT-001",
      "state": "Proved"
    },
    {
      "explanation": "credentials do not persist into reusable runner state",
      "id": "WV-CRED-001",
      "state": "NotApplicable"
    },
    {
      "explanation": "granted capabilities are required by a reachable effect",
      "id": "WV-PERM-001",
      "state": "NotApplicable"
    },
    {
      "explanation": "untrusted values do not cross an unquoted command boundary",
      "id": "WV-SEC-001",
      "state": "NotApplicable"
    },
    {
      "explanation": "secret values do not reach network, output, or logging effects",
      "id": "WV-SEC-002",
      "state": "NotApplicable"
    },
    {
      "explanation": "workflow execution cannot rewrite trusted CI definitions",
      "id": "WV-SELF-001",
      "state": "NotApplicable"
    },
    {
      "explanation": "remote executable dependencies are content-addressed",
      "id": "WV-SUPPLY-001",
      "state": "Violated"
    },
    {
      "explanation": "untrusted checkout selection cannot race a privileged consumer",
      "id": "WV-TOCTOU-001",
      "state": "NotApplicable"
    }
  ],
  "providers": [
    "azure-semantic-v1"
  ],
  "schema": "workflow-verifier-report/1",
  "summary": {
    "diagnostics": 3,
    "edges": 15,
    "nodes": 11,
    "properties": 12,
    "sources": 1,
    "unknown_properties": 0,
    "violated_properties": 1
  },
  "tool": {
    "commit": null,
    "compiler": "rustc 1.98.0 (88d9e12ae 2026-08-18)",
    "name": "workflow-verifier",
    "target": "x86_64-unknown-linux-gnu",
    "version": "0.1.0"
  }
}
