{
  "analysis_digest": "sha256:20c16c14ecdc692687545e6a4891a46159a43cb362ded9445cccd183006f1c4b",
  "completeness": {
    "reasons": [
      "Incomplete.Static_analysis",
      "Incomplete.Unbound_build_source_commit",
      "Incomplete.Unresolved_dependency: actions/checkout@v2"
    ],
    "state": "incomplete"
  },
  "diagnostics": [
    {
      "confidence": "high",
      "evidence": [
        "reference = actions/checkout@v2"
      ],
      "fix": {
        "description": "resolve and replace the reference with an immutable revision",
        "kind": "pin-dependency",
        "span": {
          "source": 0,
          "start": {
            "byte": 663,
            "column": 15,
            "line": 23
          },
          "stop": {
            "byte": 682,
            "column": 34,
            "line": 23
          }
        }
      },
      "id": "diag_b2bc7924766692a63a07130182dbbe0e3701fc5231a0c57e571d82d3cf3e6360",
      "message": "dependency is not pinned to immutable content: actions/checkout@v2",
      "rule_id": "WV-SUPPLY-001",
      "severity": "warning",
      "span": {
        "source": 0,
        "start": {
          "byte": 663,
          "column": 15,
          "line": 23
        },
        "stop": {
          "byte": 682,
          "column": 34,
          "line": 23
        }
      },
      "trace": [
        {
          "label": "mutable dependency",
          "node": 6,
          "span": {
            "source": 0,
            "start": {
              "byte": 663,
              "column": 15,
              "line": 23
            },
            "stop": {
              "byte": 682,
              "column": 34,
              "line": 23
            }
          }
        }
      ]
    }
  ],
  "digest": "sha256:7c9e9dbb79f3dea33aa0bacf2fbe3fe03364492dc779b755b7386287a26a52b5",
  "gate": {
    "exit_code": 0,
    "result": "pass"
  },
  "inputs": {
    "config": {
      "digest": "sha256:e3b0c44298fc1c149afbf4c8996fb92427ae41e4649b934ca495991b7852b855",
      "origin": "built-in",
      "trust": "built-in"
    },
    "lock": {
      "digest": "sha256:e3b0c44298fc1c149afbf4c8996fb92427ae41e4649b934ca495991b7852b855"
    },
    "manifest_digest": "sha256:3310ca44ef75acc4178ebb36da896014dbecdba7493e9d40866129d2d3f86edb",
    "sources": [
      {
        "digest": "sha256:693b79a74cb660daa8d1e716ee7f8acb64cc39242547c1d7388942c7e4cd2f97",
        "id": 0,
        "path": ".github/workflows/deploy-nfl-pass-snap-shiny.yml"
      }
    ]
  },
  "persona": "audit",
  "properties": [
    {
      "explanation": "AI agent input is trusted or isolated from tools and network",
      "id": "WV-AI-001",
      "state": "NotApplicable"
    },
    {
      "explanation": "artifact integrity is preserved across producers and consumers",
      "id": "WV-ARTIFACT-001",
      "state": "NotApplicable"
    },
    {
      "explanation": "every privileged effect is dominated by an authorization gate",
      "id": "WV-AUTH-001",
      "state": "NotApplicable"
    },
    {
      "explanation": "cache integrity is preserved across producers and consumers",
      "id": "WV-CACHE-001",
      "state": "NotApplicable"
    },
    {
      "explanation": "the lowered graph is well-formed, phase-valid, and acyclic",
      "id": "WV-CORRECT-001",
      "state": "Proved"
    },
    {
      "explanation": "credentials do not persist into reusable runner state",
      "id": "WV-CRED-001",
      "state": "NotApplicable"
    },
    {
      "explanation": "granted capabilities are required by a reachable effect",
      "id": "WV-PERM-001",
      "state": "NotApplicable"
    },
    {
      "explanation": "untrusted values do not cross an unquoted command boundary",
      "id": "WV-SEC-001",
      "state": "Proved"
    },
    {
      "explanation": "secret values do not reach network, output, or logging effects",
      "id": "WV-SEC-002",
      "reasons": [
        {
          "detail": "shell default",
          "kind": "unsupported_syntax"
        }
      ],
      "state": "Unknown"
    },
    {
      "explanation": "workflow execution cannot rewrite trusted CI definitions",
      "id": "WV-SELF-001",
      "state": "NotApplicable"
    },
    {
      "explanation": "remote executable dependencies are content-addressed",
      "id": "WV-SUPPLY-001",
      "state": "Violated"
    },
    {
      "explanation": "untrusted checkout selection cannot race a privileged consumer",
      "id": "WV-TOCTOU-001",
      "state": "Proved"
    }
  ],
  "providers": [
    "github-semantic-v1"
  ],
  "schema": "workflow-verifier-report/1",
  "summary": {
    "diagnostics": 1,
    "edges": 16,
    "nodes": 14,
    "properties": 12,
    "sources": 1,
    "unknown_properties": 1,
    "violated_properties": 1
  },
  "tool": {
    "commit": null,
    "compiler": "rustc 1.98.0 (88d9e12ae 2026-08-18)",
    "name": "workflow-verifier",
    "target": "x86_64-unknown-linux-gnu",
    "version": "0.1.0"
  }
}
