{
  "analysis_digest": "sha256:a937121df92d6f1279e3bc84881e93edf38d03423ad754fe9ee9f3b7f0963dc1",
  "completeness": {
    "reasons": [
      "Incomplete.Static_analysis",
      "Incomplete.Unbound_build_source_commit",
      "Incomplete.Unresolved_dependency: actions/checkout@v4",
      "Incomplete.Unresolved_dependency: github/codeql-action/analyze@v3",
      "Incomplete.Unresolved_dependency: github/codeql-action/init@v3"
    ],
    "state": "incomplete"
  },
  "diagnostics": [
    {
      "confidence": "high",
      "evidence": [
        "reference = actions/checkout@v4"
      ],
      "fix": {
        "description": "resolve and replace the reference with an immutable revision",
        "kind": "pin-dependency",
        "span": {
          "source": 0,
          "start": {
            "byte": 2628,
            "column": 13,
            "line": 60
          },
          "stop": {
            "byte": 2647,
            "column": 32,
            "line": 60
          }
        }
      },
      "id": "diag_b82ab106b2e0ce016f3c76ab957b28fd7ae0a327aa359ae21bbf5a550fd5031b",
      "message": "dependency is not pinned to immutable content: actions/checkout@v4",
      "rule_id": "WV-SUPPLY-001",
      "severity": "warning",
      "span": {
        "source": 0,
        "start": {
          "byte": 2628,
          "column": 13,
          "line": 60
        },
        "stop": {
          "byte": 2647,
          "column": 32,
          "line": 60
        }
      },
      "trace": [
        {
          "label": "mutable dependency",
          "node": 7,
          "span": {
            "source": 0,
            "start": {
              "byte": 2628,
              "column": 13,
              "line": 60
            },
            "stop": {
              "byte": 2647,
              "column": 32,
              "line": 60
            }
          }
        }
      ]
    },
    {
      "confidence": "high",
      "evidence": [
        "reference = github/codeql-action/init@v3"
      ],
      "fix": {
        "description": "resolve and replace the reference with an immutable revision",
        "kind": "pin-dependency",
        "span": {
          "source": 0,
          "start": {
            "byte": 2740,
            "column": 13,
            "line": 64
          },
          "stop": {
            "byte": 2768,
            "column": 41,
            "line": 64
          }
        }
      },
      "id": "diag_255bbfcc52c8708bbfe0b2ab5d69557e08782b0d75484bfc181f174ccb20942f",
      "message": "dependency is not pinned to immutable content: github/codeql-action/init@v3",
      "rule_id": "WV-SUPPLY-001",
      "severity": "warning",
      "span": {
        "source": 0,
        "start": {
          "byte": 2740,
          "column": 13,
          "line": 64
        },
        "stop": {
          "byte": 2768,
          "column": 41,
          "line": 64
        }
      },
      "trace": [
        {
          "label": "mutable dependency",
          "node": 9,
          "span": {
            "source": 0,
            "start": {
              "byte": 2740,
              "column": 13,
              "line": 64
            },
            "stop": {
              "byte": 2768,
              "column": 41,
              "line": 64
            }
          }
        }
      ]
    },
    {
      "confidence": "high",
      "evidence": [
        "reference = github/codeql-action/analyze@v3"
      ],
      "fix": {
        "description": "resolve and replace the reference with an immutable revision",
        "kind": "pin-dependency",
        "span": {
          "source": 0,
          "start": {
            "byte": 4274,
            "column": 13,
            "line": 92
          },
          "stop": {
            "byte": 4305,
            "column": 44,
            "line": 92
          }
        }
      },
      "id": "diag_3a7683df0722a7c0921045083e0ce444406db9f636b2386fa2dc4c07d00b013d",
      "message": "dependency is not pinned to immutable content: github/codeql-action/analyze@v3",
      "rule_id": "WV-SUPPLY-001",
      "severity": "warning",
      "span": {
        "source": 0,
        "start": {
          "byte": 4274,
          "column": 13,
          "line": 92
        },
        "stop": {
          "byte": 4305,
          "column": 44,
          "line": 92
        }
      },
      "trace": [
        {
          "label": "mutable dependency",
          "node": 17,
          "span": {
            "source": 0,
            "start": {
              "byte": 4274,
              "column": 13,
              "line": 92
            },
            "stop": {
              "byte": 4305,
              "column": 44,
              "line": 92
            }
          }
        }
      ]
    }
  ],
  "digest": "sha256:8a8e582df6a9fbfaeb507debc2d33ffff88426a8d2bed3ccc954b94005c57b07",
  "gate": {
    "exit_code": 0,
    "result": "pass"
  },
  "inputs": {
    "config": {
      "digest": "sha256:e3b0c44298fc1c149afbf4c8996fb92427ae41e4649b934ca495991b7852b855",
      "origin": "built-in",
      "trust": "built-in"
    },
    "lock": {
      "digest": "sha256:e3b0c44298fc1c149afbf4c8996fb92427ae41e4649b934ca495991b7852b855"
    },
    "manifest_digest": "sha256:855af6002a444fd6b20ab7caf92c05058fa335af2337b208243e33464a720f6c",
    "sources": [
      {
        "digest": "sha256:5a9365a48eb6eb3b66f3807c5617bc49d5889a2ce07d3083603a02c6cf3b5c6e",
        "id": 0,
        "path": ".github/workflows/codeql.yml"
      }
    ]
  },
  "persona": "audit",
  "properties": [
    {
      "explanation": "AI agent input is trusted or isolated from tools and network",
      "id": "WV-AI-001",
      "state": "NotApplicable"
    },
    {
      "explanation": "artifact integrity is preserved across producers and consumers",
      "id": "WV-ARTIFACT-001",
      "state": "NotApplicable"
    },
    {
      "explanation": "every privileged effect is dominated by an authorization gate",
      "id": "WV-AUTH-001",
      "state": "NotApplicable"
    },
    {
      "explanation": "cache integrity is preserved across producers and consumers",
      "id": "WV-CACHE-001",
      "state": "NotApplicable"
    },
    {
      "explanation": "the lowered graph is well-formed, phase-valid, and acyclic",
      "id": "WV-CORRECT-001",
      "state": "Proved"
    },
    {
      "explanation": "credentials do not persist into reusable runner state",
      "id": "WV-CRED-001",
      "state": "NotApplicable"
    },
    {
      "explanation": "granted capabilities are required by a reachable effect",
      "id": "WV-PERM-001",
      "reasons": [
        {
          "detail": "actions/checkout@v4",
          "kind": "unresolved_dependency"
        },
        {
          "detail": "github/codeql-action/analyze@v3",
          "kind": "unresolved_dependency"
        },
        {
          "detail": "github/codeql-action/init@v3",
          "kind": "unresolved_dependency"
        }
      ],
      "state": "Unknown"
    },
    {
      "explanation": "untrusted values do not cross an unquoted command boundary",
      "id": "WV-SEC-001",
      "state": "Proved"
    },
    {
      "explanation": "secret values do not reach network, output, or logging effects",
      "id": "WV-SEC-002",
      "reasons": [
        {
          "detail": "github/codeql-action/analyze@v3",
          "kind": "unresolved_dependency"
        },
        {
          "detail": "github/codeql-action/init@v3",
          "kind": "unresolved_dependency"
        }
      ],
      "state": "Unknown"
    },
    {
      "explanation": "workflow execution cannot rewrite trusted CI definitions",
      "id": "WV-SELF-001",
      "state": "Proved"
    },
    {
      "explanation": "remote executable dependencies are content-addressed",
      "id": "WV-SUPPLY-001",
      "state": "Violated"
    },
    {
      "explanation": "untrusted checkout selection cannot race a privileged consumer",
      "id": "WV-TOCTOU-001",
      "state": "Proved"
    }
  ],
  "providers": [
    "github-semantic-v1"
  ],
  "schema": "workflow-verifier-report/1",
  "summary": {
    "diagnostics": 3,
    "edges": 24,
    "nodes": 19,
    "properties": 12,
    "sources": 1,
    "unknown_properties": 2,
    "violated_properties": 1
  },
  "tool": {
    "commit": null,
    "compiler": "rustc 1.98.0 (88d9e12ae 2026-08-18)",
    "name": "workflow-verifier",
    "target": "x86_64-unknown-linux-gnu",
    "version": "0.1.0"
  }
}
